{
  "schemaVersion": "0.1.0",
  "metadata": {
    "name": "Forest Slice",
    "description": "Minimal predator-prey-resource world for validation against the world-pack schema.",
    "version": "0.1"
  },
  "rngSeed": 42,
  "entities": [
    { "id": "herbivore_1", "kind": "herbivore", "label": "Herbivore A", "state": { "energy": 60, "chi": 30 }, "position": { "x": -10, "y": 15 } },
    { "id": "herbivore_2", "kind": "herbivore", "label": "Herbivore B", "state": { "energy": 55, "chi": 28 }, "position": { "x": 20, "y": -12 } },
    { "id": "predator_1", "kind": "predator", "label": "Wolf", "state": { "energy": 90, "chi": 45 }, "position": { "x": 0, "y": 40 } },
    { "id": "food_patch_1", "kind": "resource", "label": "Berry Patch", "state": { "vitality": 1.0 }, "position": { "x": -40, "y": 5 } },
    { "id": "food_patch_2", "kind": "resource", "label": "Carrots", "state": { "vitality": 1.0 }, "position": { "x": 35, "y": -25 } },
    { "id": "den_1", "kind": "den", "label": "Den", "position": { "x": -5, "y": 50 } }
  ],
  "relations": [
    { "id": "r1", "primitive": "GEOMETRY", "source": "herbivore_1", "target": "food_patch_1", "weight": 1.0 },
    { "id": "r2", "primitive": "GEOMETRY", "source": "herbivore_2", "target": "food_patch_2", "weight": 1.0 },
    { "id": "r3", "primitive": "CONSTRAINT", "source": "den_1", "target": "herbivore_1", "weight": 0.8 },
    { "id": "r4", "primitive": "CONSTRAINT", "source": "den_1", "target": "herbivore_2", "weight": 0.8 },
    { "id": "r5", "primitive": "DYNAMICS", "source": "food_patch_1", "target": "herbivore_1", "weight": 1.0, "payload": { "gain": "energy" } },
    { "id": "r6", "primitive": "DYNAMICS", "source": "food_patch_2", "target": "herbivore_2", "weight": 1.0, "payload": { "gain": "energy" } },
    { "id": "r7", "primitive": "EPISTEMIC", "source": "predator_1", "target": "herbivore_1", "weight": 1.0 },
    { "id": "r8", "primitive": "EPISTEMIC", "source": "predator_1", "target": "herbivore_2", "weight": 1.0 },
    { "id": "r9", "primitive": "DYNAMICS", "source": "predator_1", "target": "herbivore_1", "weight": 0.6, "payload": { "action": "hunt" } },
    { "id": "r10", "primitive": "DYNAMICS", "source": "predator_1", "target": "herbivore_2", "weight": 0.4, "payload": { "action": "hunt" } }
  ],
  "toggles": {
    "plantEcology": true,
    "adaptiveReward": true,
    "scentGradient": true,
    "mitosis": true,
    "decay": true,
    "signalField": true,
    "participation": true,
    "learning": false,
    "autonomy": true,
    "rendering": true
  },
  "geometry": {
    "resourceRadius": 8,
    "trailCell": 7,
    "fertilityCell": 75,
    "patchRadius": 180,
    "harvestRadius": 40,
    "pressureRadius": 180,
    "opportunityRadius": 220,
    "scentMaxRange": 400,
    "participationRadiusResource": 80,
    "participationRadiusDistress": 100,
    "participationRadiusBond": 70,
    "linkRadius": 120,
    "wallAvoidMargin": 100,
    "sampleDistance": 46,
    "orbitBand": 140
  },
  "constraints": {
    "maxAgents": 50,
    "maxAliveAgents": 50,
    "respectCarryingCapacity": true,
    "carryingCapacityMultiplier": 1.5,
    "resourceStableMin": 2,
    "resourceStableMax": 6,
    "resourceScaleMinimum": 5,
    "resourceScaleMaximum": 80,
    "resourceRespawnCooldown": 100,
    "trailCooldownTicks": 8,
    "ownTrailGraceAge": 10,
    "adaptiveRewardMin": 3,
    "adaptiveRewardMax": 100,
    "activationThreshold": 0.08,
    "memoryLength": 12,
    "minStrength": 0.2,
    "minRange": 150,
    "minVitality": 0.0,
    "depletionThreshold": 0.3
  },
  "ecology": {
    "resourceDynamicCount": true,
    "resourceInitialMin": 4,
    "resourceInitialMax": 6,
    "resourceStableMin": 2,
    "resourceStableMax": 6,
    "resourceDepletionRate": 0.025,
    "resourceRecoveryChance": 0.1,
    "resourceCount": 5,
    "resourceScaleWithAgents": true,
    "resourceBaseAbundance": 50,
    "resourceCompetition": 1.0,
    "resourceScaleMinimum": 5,
    "resourceScaleMaximum": 80,
    "plantEcology": {
      "initialFertility": 0.7,
      "fertilityVariation": 0.6,
      "seedChance": 0.01,
      "seedDistance": 100,
      "growthFertilityThreshold": 0.3,
      "growthChance": 0.1,
      "patchCount": 4,
      "patchRadius": 180,
      "patchFertility": 0.3,
      "harvestDepletion": 0.2,
      "harvestRadius": 40,
      "fertilityRecovery": 0.1,
      "maxFertility": 1.0,
      "populationPressure": true,
      "pressurePerAgent": 0.01,
      "pressureThreshold": 10,
      "spawnPressure": {
        "startAgents": 8,
        "maxAgents": 50,
        "minSeedMultiplier": 0.35,
        "minGrowthMultiplier": 0.2,
        "minResourceMultiplier": 0.3
      }
    }
  },
  "reproduction": {
    "maxAgents": 50,
    "maxAliveAgents": 50,
    "respectCarryingCapacity": true,
    "carryingCapacityMultiplier": 1.5
  }
}
